id	text_cleaned
1	i dont care the taghut kuffar will never fulli beat islam but we muslim can if we just get unit to beat the kuffar
2	migrant are behav primit in ostend throw all their trash in the sea from bottl to diaper like barbarian omvolk oostend
3	ostend in better time befor the great geplac oostend omvolk
4	ostend in 2022 dure the genocid by substitut in which nativ belgian are be replac by predominantli afroarab muslim migrant omvolk oostend
5	so when do we start kill all the nigger and jew get pretti fuck tire of let them exist we have the gun what stop you pussi from spill blood on the negroid and matza street
6	thi won an award in israel these are the peopl call you racial supremacist their religion liter normal casual slaveri of the inferior race the goy judaism teach that a goy you is closer to an anim than a jew is to a goy but your the supremacist
7	the jewnit cuckstat of anegrikkka are the sourc of everyth bad in the world be it social polit or whatev inb4 hurr argentina you rais a fair point but your overlook the main issu let me explain it to you argaytina is a piec of nigger shit useless countri and niggertinian peopl are the most despic subhuman and useless shitblood browngoloid on the surfac of earth argaytinian are walk anthropomorph mountain of shit whose cadavr arent even use a manur and browngentina is a giant radioact scat dungeon that should be nuke and glass repeat the oper one million time until noth remain on it place for at least one million eon a viru that target onli niggertinian hominid should be creat to assur the extermin of everi singl argaytinian piec of turd subhuman roam out there until noth of thi giant latrin remain on the record of histori the argaytinian flag look like the tran flag becaus thi is a countri of useless dick crippl subhuman whose blood shouldnt even touch the earth a it would contamin it and ruin it forev a vapor weapon would be the best kind of thing to use against the argaytinian cockroach to fulli delet them from thi plane fuck you fuck me and fuck thid nigger piec of shit useless shithol countri and fuck everi singl niggertinian ape their dead parent and ancestor their rape sister their kill mother and everi other humanoid trash they call famili
8	the summari of the last night audio speech by sheikh abu umar almuhajir may allah safeguard him the offici spokesman of the caliph ramadan greet to the ummah of mohammad the battl to aveng the two sheikh launch on the 17th night of ramadan the exact night the battl of badr took place 1441 year ago alaqsa and the rest of muslim land would onli be liber by the peopl of true tawhe not by the nationalist or the agent of tawagheet here and there five messag for the brave soldier and loyal support of the caliph and our prison men and woman salam of the caliph abu alhassan alhashemi a lot of good wish and word of motiv for those who onc were in the rank of mujahideen and now have sat back they have tast the honor and glori of jihad so how could they live now without that tranquil call for them to join back for those who have sat back from jihad and the son of ummah altogeth the jihad is an oblig upon them all and the onli way to the lost glori of ummah and remov of corrupt apost tawagheet is through jihad for all the nation of kufr and apostasi we will remain fight you for the sake of allah religion until there is no shirk anymor so repent if you still have got ani sen for the great warrior of islam the lone wolv of the caliph in the land of cross advanc never ceas you heal our heart and enrag the enemi of islam prayer and good wish for the lion of tawhe in palestin who terrifi the jew just recent s continueyourincit
9	o peopl of power o muslim armi the democrat system ha fail it ha collaps be muslim it your utmost duti to give nussrah to hizb ut tahrir for establish khilafah rejectdemocracyestablishkhilafah
10	fag are a liter public health hazard some of these peopl alreadi had std when they got monkeypox some of them had aid covfefeanon
11	ya murtad do you expect from the muslim to give up jihad and let the kuffar take over their land your kind keep ask their american master to start a second invas of afghanistan but have a problem when afghan show resist
12	388345708 neoliber owner of romania replac the current workforc with immigr so they dont have to pay romanian a live wage high enough to rais romanian kid side effect white genocid and great replac your mortal enemi ani and all jew and american and anglo wall street banker financi institut like blackrock big intern corpor
13	388315145 kike hate white period a evidenc by the great replac they want the public to hate nigger democrat republican christian white russian china and anyon so long a they dont hate kike it the old divid and conquer strategi everyon get trick into fight everybodi except the jewish elit who own everi power institut
14	cope harder you inferior infidel dog islam is back and stronger than ever there is noth stand in the way of sunni islam conquer the entir globe and here is whi no doubt you pathet kuffar dog have heard about the brave mujahideen victori over the u led globohomo coalit in afghanistan all prais to allah the mujahideen have defeat russia twice then the entir wstern world unit against u and still lost do you realli believ the mujahideen could have done thi with ani other ideolog can you dog imagin chrstain warrior jwish warrior bhddist warrior shiit warrior or even athist warrior complet such a feat thi is whi sunni islam will win thi is whi sunni islam is here to stay thi is whi sharia law is here to stay who the fuck do you think you infidel dog are mess with we mujahideen are war veteran of the highest standard your all littl pathet cumskin dog who jerk off to cartoon then watch anim after all you pathet littl cumskin did to fight back against u wa chang your facebook profil pictur lmao who the fuck do you think is go to win kaffir sit the fuck down i promis you infidel dog you will all either convert or kneel at our foot the kike have bred you cumskin infidel to be effemin pussi over the last 200 year remind me again what music is popular in your kuffar countri autotun pop with some fat slut shake her as the mujahideen produc superior jihad nashe how the fuck can you kuffar and apost dog compet you have no strength no zeal and no warrior even if you white dog did have a small percentag of abl warrior i guarante you they would rather join the mujahideen the wst is ripe for islam takeov by 2050 and there is noth you can do about it
15	388313331 the insidi of jewish power httpsgabcomapoliticalposts108690860226324065 our destroy countri httpswwwpaulcraigrobertsorg20220720ourdestroyedcountri httpsarchivevncdfmw civil war in the u is inevit becaus social cohes nation uniti and social trust are gone and they are never come back it took over 80 year of intern sabotag to achiev it via demographicethn and cultur subvers and the damag is perman and irrevers the futur will be decid by those strong and determin enough to carv their own futur when they rebuild from the ash of the alreadi dead usa httpswwwarmstrongeconomicscominternationalnewspoliticspushingtheenvelopforcivilunrest httpsarchivevntzcj6 jew control america and one proof of that fact is that they tri to destroy anyon that openli state that fact httpsgabcomhalpposts108686054113662612 the west is not die it be kill and the peopl kill it have name and address disclaim alway follow the law httpsgabcomkirkcpposts108700343977903311 how jew subvert china with their nation wreck commun httpsgabcomhenrikpalmgrenposts108699374625180745 httpswwwdailymailcouknewsarticle11032711americanssurveyviolenceuniversitycaliforniadavisdemocracythreatcivilwar httpsarchivevntsmg3 half of american expect a second u civil war within year more than 40 agre with great replac theori and nearli a fifth expect they will choos to bring a gun to a violent polit row alarm poll show
16	you crossdog cant do shit against u the mujahideen have defeat russia twice then the entir wstern world unit against u and still lost who the fuck do you think you infidel dog are mess with we mujahideen are war veteran of the highest standard your all littl pathet crossdog who jerk off to cartoon then watch anim after even your own crossdog woman cant stand the sight of you what the say the loudest dog ha the weakest bite remind me again what you white crossdog did after the mujahideen martydom oper all over europ australia and the u the past 5 year do you rememb all you pathet littl crossdog did to fight back against u wa chang your facebook profil pictur lmao who the fuck do you think is go to win kuffar sit the fuck down sunni islam is come sharia law is come the caliph is come and you white infidel dog cant do a thing about it keep bark at the rise of islam you crossdog you wont be laugh when your infidel woman are get slaughter by soldier of the caliph you wont be laugh when your faggot and tranni friend are get thrown off rooftop isi style you wont be laugh when there is a knife to your throat and your in a retir home cri over the fact that muslim bred you out of exist sunni muslim and shia dog will wipe the infidel dog from thi planet the black flag of the caliph will fli from the ruin of parliament hous the crossdog will be behead and hi head instal on a fenc post a a warn to other infidel inshallah
17	388314190 the consequ of allow jewish collect power to oper in ani countri httpstwittercompetersweden7status1540723517225897985 httpsarchivevnwkwv9 spain border polic ha had enough httpsgabcomnatureandraceposts108546230921637478 danger to name those that enslav you httpsodyseecomjohntheconfederate1a2ba5105e9521f4c9 jewish ngo facilit immigr from 3rd world into the west httpsgabcomthenoseposts108611429861594272 corpor cultur is 100 antiwhit and need to be purg if the west is to surviv httpsarchive4plebsorgpolthread385670550 two dutch 20 year old virgin girl rape by invad at hi refuge statu acquisit parti httpsarchive4plebsorgpolthread386047866 9 year old swedish girl beaten into coma by 13 year old ethiopian invad just given perman resid httpsarchive4plebsorgpolthread387015849 white genocidegreat replac is a realiti httpsgabcomthuletideposts108624250636020670 httpsgabcomthenoseposts108673715300682818 httpsgabcomvdareposts108671508378139224 how the republican parti betray all white peopl httpsgabcomhalpposts108651362417972277 httpsgabcomshadowknight412posts108649973516451910 how the uniparti work democrat bring the invas of illeg in republican turn them into legal citizen one hand wash the other httpsgabcomnatureandraceposts108657311689516085 white peopl have no polit represent in the west httpsgabcomstanleymitchell90posts108667944768995822 httpsgabcomapoliticalposts108674031486224901
18	nigger woman attack cop becaus get arrest is the onli way they can get white men to touch them
19	better to live in the stone age than your modern age of wstern valu such a the worship of homosexu nigger tranni and other undesir you white infidel dog are go extinct and most of you are cheer for it that is whi you are so hostil i can see the desper insid of you know there is noth you can do to save yourself save your race or save your cultur the mujahideen will replac you we are replac you and the best part is you cumskin infidel are financ the entir thing sunni islam and sharia law is come kaffir and we will not be kind to the like of you
20	keep insult i will kill 1000 infidel i will let the soil drink from your blood kaffir pig you will never defeat u we will kill you all we will terror you in your home we will murder your child enslav you and work you to death and sell your woman into sex slaveri and rape them to death we will burn down your civil to the ground
21	salaam alaikum my name is abu khorosani alaustrali im a 27 year old australian mujahid jihadi for you infidel i read the quran and isi train manual on my tablet and spend my day perfect my bomb make skill and listen to superior nashe by alhayat medium group i train with my unregist firearm everi day thi superior weapon can cut clean through kevlar becaus it is made by russian slave in rust factori and is vastli superior to ani other firearm on earth i have been get better everi day i speak arab and pashto fluentli i know everyth about islam histori and their sharia law which i follow 100 when i get my iranian visa i am cross the border into afghanistan to attend a prestigi train camp to fight the taliban apost dog and learn about the brave mujahideen of the islam state i hope i can becom a suicid bomber for isisk or an i design i own sever islam head band which i wear around town i want to get use to wear them befor i move to afghanistan so i can fit in easier wish me luck in khorasan provinc
22	388158488 be me earli 2022 live in absolut citi center of big citi watch medium video explain whi the great replac is a xenophob farright theori look out window 50 of passerbi are either nigger or arab move out of thi hellhol but theyr everywher
23	remind that shariah law will be establish and there is noth you can do about it thi will be the anthem of the islam european union httpsmyoutubecomwatchvitjeycnux5 emb ye homosexu will be execut ye adulter will be stone ye fornic will be lash ye magicianssatanist will be execut ye usuri will be ban ye alcohol and intoxic will be ban ye we will take woman right away ye woman will be remov from politicsmedia ye we will bring back the gold standard ye atheist and pagan will be annihil ye christian and jew will have to pay the 2 tax jizya or they will be annihil too ye we will get rid of the age of consent ye we will bring back slaveri ye you will live to see thi happen
24	have white child is the singl most base thing a man can do in today world the kike want the shitskin breed out of control to replac u and everyon know thi it an open secret fight them anon go forth and multipli
25	i think ive had just about enough of clown world it all so tiresom gon na rampag on some peopl who deserv it for onc screencast thi
26	thi insan nepot onc a kike infiltr an organ it is onli a matter of one or two gener befor they have their whole kike famili in everi high up posit the indian poo are do the same thing with the tech industri in the usa
27	do you want a burial out in the bush where nobodi will find you keep bark the way you are dog the mujahideen prepar for the worst the mujahideen prepar for fight against overwhelm air superior number technolog and against all odd the mujahideen are expert in all warfar and have the victori to prove it so i ask what the fuck is one littl cumskin infidel like you gon na do let me tell you do you know what the mujahideen did today they train for jihad for attrit for endless war do you know what you did today you jerk off to men in skirt then watch anim like the rest of your fellow cumskin did who the fuck do you think is go to win kaffir you dog truli are fuck pathet im sorri more of you werent kill by the mujahideen but there good news at least you cumskin dog are financ your own replac and most of you are even happi about do so the west will be sunni islam by 2050 your birth rate is at replac level and drop fast you white cumskin have no warrior no cultur no zeal or no confid you should thank u for put you out of your pathet miseri like an injur dog i almost piti you cumskin infidel know sunni islam is come but there is noth you can do
28	i hope palestin and israel kill each other idiot i never said pissrael wa good fuck kike and fuck sandnigg fuck kikelov and sandniggerlov too all hail robert bower all hail brenton tarrant all hail frazier glenn miller
29	that is quit the psycholog project you got go on there be rememb for someth it about kill peopl who shouldnt be aliv or to send a messag not fuck fame retard you wish to be famou not mass shooter howev brenton tarrant is a hero and defend of western civil god bless him fuck jew
30	and peopl are fuck surpris that brenton tarrant fuck took it out on new zealand there should be more of him
31	let dedic thi thread to our hero brenton tarrant the sand nigger cleanser
32	whi doe poltard disown brenton tarrant by call him a rabbi or jew for have visit israel he visit north korea that doesnt make him a communist gook he visit pakistan and some middl east countri that doesnt make him a paki or a muzzi he visit ethiopia that doesnt make him a nigger he attack muslim not kike becaus robert bower attack a leftist kike synagogu just a few month ago and almost no one in modern histori attack muslim live in white countri onli asid from alexandr bissonnett despit muslim make the deadliest terror attack in white countri 911 attack 2977 dead 2015 pari attack 130 dead beslan school sieg 430 dead 2016 nice franc attack 86 dead 1999 russian apart bomb 100 to 200 dead also muslim are breed like rabbit and groom gang target white littl girl inb4 muh muslim base they right about faggot and kike if theyr base then whi do most muslim terror attack european victim arent gay or kike and whi doe muslim extrem veri rare attack target kike or faggot huh hypocrit much suck muslim dick inb4 fed glowi thread fals flag your so predict idiot you think white men aveng terror attack arent real then if it never happen then white look like cuck becaus they just let themselv be kill by terror attack and wont aveng poltard are differ from polchad poltard are low iq like nonwhit and immedi call anyon they hate or disown jew but polchad are high iq peopl who will onli believ a person is a kike onli if there a solid evid polchad are the complet opposit the real ubermensch
33	base and 4channi a fuck go commit an act of 4chan how mani bodi bag can you fill can you meet the high score of brenton tarrant patron saint of pol
34	everi time someon say two more week i want to rip my fuck hair out take a look around you stupid cock suck mother fucker it is now for the first time ever gener known that the govern is run by actual liter satan pedophil now you can say whatev you want about about how you were the first one ever redpil and how you know everyth and how noth ever happen but im tell you it alreadi fuck happen it just so big you cant even fuck see it imagin that you spent 10 year dig and meme and read and when the shit final hit the fan you were sit there with your thumb up your as look like a fuck retard whew
35	without question thi is one of the most frustrat attitud on pol i hate q becaus i alreadi know everyth he say and he appeal to boomer and not me i hate russel brand becaus i alreadi know everyth he say and he appeal to normi and not me i hate white rapper becaus i alreadi know everyth they say and they appeal to idiot and not me that the fuck point you retard everyon here who isnt a shill or bot alreadi know about the kike and their lie whi would anyon creat medium to tell you what you alreadi know the point is to spread that awar to all the peopl who dont alreadi think like u who wouldnt normal come here and to get a mani of them on our side a fuck possibl to counter the kike psyop we use to fantas on b and in the earli day of pol about a time when the mass would start question 911 and sandi hook and other kike bullshit but now were overrun with bitchi whine narcissist that are threaten becaus their superfici ident a be in the know about the kike is threaten omg i knew thi shit ten year ago fuck idiot fuck you im special and you are beneath me the peopl who think thi way are liter no fuck differ than those in secret societi who want to hoard secret knowledg for themselv and it realli is a great illustr of how such organ can be sustain in the first place get the fuck over yourselv and rejoic that what we believ is increasingli ceas to be fring extremist schizo shit inb4 muh control opposit you will say that about anyon who experi success in spread our idea to a wide audienc sick of thi wellpoison bullshit inb4 muh grifter whi the fuck do you care if someon el is make money if theyr tell the truth again more wellpoison from peopl who just seem to want to stop the mass awaken that is alreadi happen
36	hitler wa the chosen one one of the great judg prophesi sinc ancient day hi spirit will rise again thi time in north america we are nearli there the more they demor u the closer we get to our awaken there will be anoth like him that ha spent their entir life inspir by him the north american empir will begin a a nationalist socialist state even if we are defeat by the entir world assail our contin we will make such a stand that the world will never again dare to challeng u on a racial basi by 2025 you will all see for yourselv what i speak of destini is upon u
37	worship jew god is be a race traitor caus you hold the jew chosen race abov yourself thi is slave cuq niggershit atheism is jewtv degeneraci and is also jewish jew full spectrum domin nigger the solut is a singl point a new religion with a white god becaus perfect tree of racist logic which are necessari for the surviv of recess peopl are unobtain by the mass so they will have to be brainwash by a system for u by u where we write the rule instead of jew and christkik hybrid write the rule to genocid u thi is fuck start point the more you fuck nigger ignor thi all you do is embrac your doom you do not pas go you go straight to hell nigger keep suck that jew god dick seem like it work out for you
38	bewar of antiwhit psyop psycholog oper agentspost shill a fals narr usual post someth that denigr or intend to caus harm to white these peopl will post thread and may also pretend to interact within a thread again in a manner to caus harm to white popular topic includ bbc white replac white genocid bnwo interbreed cuckold insult demor tri to caus divis among white tri to confus white other topic includ shill for progressiveliber agenda attempt to keep white men away from black woman tri to make it seem normal for white woman to date outsid their race they want white men to remain passiv or they want white men to leav the countri racism and racist are new concept racism be introduc in 1902 and not becom popular until 1930 design to weaken the white and empow black it a if someon want you to stop breath so they call you a breathist and tri to make you feel guilti about breath same thing with racist they dont want you to use your natur abil of discrimin becaus black can not compet and thi allow them to victim you without fear of retali learn about what realli go on start here necessari nigger inform massiv amount of use info b882794370 nigger without camouflag rare glimps at realiti b882794421 victim of black hatr dont let thi continu b882794472 most peopl dont know what happen so plea help to spread awar
39	ok gangstalk nigger are start to becom a realli big problem especi in my hometown of chicongo illinigg in the unigg state it ha gotten to the point where if i interact with anyon who contain melanin within their skin who isnt either violent or complet unintellig it perplex me ive actual had to tri to studi ebon just to deciph the bix nood shit to stay a step ahead of their tweak if nigger or ani non white are go to stick around a a whole then first of all we need to remov the uppiti retard cultur that infect mani minor and even some white i call it the bad cultur the problem is that it almost imposs to get rid of the bad cultur through rhetor mean let alon legisl lmfaooo sinc it self perpetu start at young age practic speak ani real futur action regard nigger especi when it come to retak american urban area would have to be in minecraft
40	the sign say that the shop wa formerli chuck impli that the two word begin with f and s would have end with uck rhyme with chuck so when chuck own the shop it would have been call chuck fuck and suck therefor the shop is obvious involv in pornographi sneed bought the shop off chuck sneed is a popular jewish surnam chuck wa sell oldfashion american porn but the porno shop is now own by a jew the shop is now call sneed feed seed it a refer to the bbc porn he now promot in which white woman are fed and seed by bbc feed and seed both end in the sound eed thu rhyme with seeth the joke is a doubl entendr jew feed you bbc porn while you jerk off and seeth so the shop is actual call sneed feed and seeth sneed feed and seeth sneed feed and seeth sneed feed and fuck seeth janni thi is poolitc a sneed is a metaphor for the current porn problem
41	join the great aryan awaken the pic is a symbol of our race and movement here is more info newest english translat of the oera linda book httpsoeralindanl audio read httpsyoutubekdpjnvuntqw three video deal with a introduct to the aryan scriptur httpsyoutuberytwugmloy httpsyoutubexujbnhkty4 httpsyoutubegvt5jjnmruc here is a link deal with our origin and evid httpsaryanscriptureswordpresscomthehymnofouroriginchapter1 and a prayer for all aryan httpsyoutubecomshortszelbn5p1yhifeatureshar wear the symbol proudli
42	your not welcom here dna is jewish so here are the minimum requir not a jew white skin brown hair not dark brownblack if your hair look black in a well lit room fuck off brown eye are fine a long a theyr light brown dark brownblack fuck off if you pas these but your ugli without be extrem skill at someth then fuck off you may a well be a jew those are the appear requir here are some further one no listen to rap music no smoke or vape drink onli in moder of cours you will be given a littl time to chang a weve been born into certain vice in thi evil jew world sieg heil
