id	text_cleaned
249	390345465 god is a jew kike tripe im nit atheist you retard what are you a jew a satanist same thing 390345642 whi shouldnt you be is right answer 390345723 390345928 390346393 390346398 rofl nice tri kike 390346997 390348051 390347784 390349499 390350334 varg lol 390350627 is is time to either admit you are jew shill or becom orthodox 390345842 yeah theyr start to see it no use to shill forev
250	noth is for hindu thi world wa creat by allah swt everi resourc everi fibr of your bodi everi subatom particl belong to allah swt how exactli isnt everi 9th out of 10 muslim crave jihad against these mushrekeen it our job
251	bewar of murtideenmulhideenmunafeqeenmushrekeenkafireenaround ukillthem where ever u find themqita and jihad r allow in islamor they will kill uin self defencelast prophet pbuh pick up the swordrememb
252	mother natur is racist ani race that doe not defend itself will go extinct surviv of the ancestorselfvalu
253	same stori if your nonwhit your taught to be proud but if your white and proud your a racist and jew are the perpetu victim black are the live proof of white oppress asian are superior to all hispan are the cultur truth and arab are the poor misunderstood angel
254	after be put in the facebook gulag for some time the page is back and readi to fight white genocid
255	europ is wake up httpsgooglua6mz
256	a good truism stop whitegenocid
257	know your foreign enemi and open fire
258	veri good video share amongst your friend and famili a lot of footag censor from our antiwhit medium
259	white peopl thi is how verifi twitter approv think of you and your famili not onli do they want to genocid our peopl through mass immigr and forc integr program to breed u out they encourag u to kill our kid stopwhitegenocid
260	a unit state of europ idea wa reject by patriot in europ today the idea wa put forth to put down resist to the flow of refuge that is diversifi europ today a we all know too well diver is just a codeword for le white thi is also a good time to rememb that white genocid that is the destruct of our peopl is not someth specif to one countri or contin antiwhit want all our peopl destroy it a global fight stopwhitegenocid
261	everi western white countri are under attack from white genocid i think it is time we give them what they so desesper want from u true and utter racism let demonstr how much of a folli it is to wish for some thing becaus they just might happen if white skin make u racist from birth fine but a true racist extermin ani other ethnic
262	if the men that storm the beach of normandi knew that their victori would lead to thi moral ce pit they would have walk up those beach and join the axi forc in their crusad to smash commun and liber
263	jew openli encourag and celebr white replac in our own countri but were the bad guy for want them all repatri to israel pfffft
264	the fbi is gay
265	fuck the fed it not the fed it the jew
266	trump is awar of what is come that whi he creat the trump check trump check will save your life becaus he know what is come covid19 wa just the test they isol u from everyon and made u poor you dont know what is come prepar yourself the stock are veri low after trump publish them we are sorri if there wont be enough for everyon get at least x100 and thank me later
267	fire all of them make sure they never work in law enforc again
268	im afraid fbi might plant someth dem have been full of lie and get away w it anyway plant someth might be next step for psycho democratsdeep state oper
269	defend your whiteheritag and have some whiteprid
270	good morn to everyon except the sorri af corrupt fbi they can go fuck themselv
271	the fbi is the enemi of everi freedom love american
272	if you dont have hatr for the rawafidh mushrikeen you havent understood the mean of
273	harm a muslim becous of hi religion is a nullifi when peopl make takfeer on taliban on such ground i wont blame them p the sheikh hasnt mention ani group
274	390480179 your a fuck moron dehuman yourself and face to bloodsh your mani enemi did long ago they want you dead they want to rape your child they think it funni 390480430 you need rope motherfuck you are alreadi extinct jew 390480735 no one here wast ani time or energi debat filthi disingenu yid faggot go play in traffic and await your turn on the rope ride jew
275	390470282 i onli hate nigger kike you know whether your a nigger or a kike or not the bibl also say not to breed outsid your own peopl get fuck nigger jew satan faggot boy lover
276	america is occupi by a hostil regim much a when nazi control pari compli when you must resist when you can recogn we are face true evil
277	390470325 jesu wa an israelit call out the nigger blood aka the nigger jew for not belong to hi peopl jesu wa the pure of pure the holi of holi it whi kike seeth so much at the mention of jesu becaus jew and nigger are sub anim by blood
278	if muslim troop can be sent around the world for the un whi can they not be sent to palestin for jihad in the path of allah swt by the khilafah
279	390468496 390479589 imagin the presumpt and arrog of first of all claim who or who doesnt have a soul and secondli basic say god isnt allowedc do that god can do whatev the fuck he want and i think he hate you thi is whi god hate you rat never forget that you arent actual a jew but a disgust genet aberr mudblood arab who claim he jewish in an attempt to steal an inherit like a nigger whitewash himself to pretend he deserv a cut but remind yourself that you are the one who took it thi far couldnt be content with your shitshack in a desert could you had to keep jammer about muh goy slave i need um we alreadi know what you are go to do if we win you will wish for death but it shall not be grant your name and lineag will be dash and end your name forgotten and nobodi will call you the jew becaus you arent werent and never will be your heart is dark and fill with evil you will never escap you will be judg and you will kvetch for all etern
280	the distanc to palestin is no obstacl for the muslim soldier who want the jannah whose width is that of the heaven and the earth establish khilafah and lead the armi of million readi for martyrdom
281	390479390 your idea of what the nazi want to be is veri off the mark they were not jew murder they were hero and savior of the west on their own view
282	it is the glad tide of the prophet saw that the muslim will fight the jew befor the last day let the muslim armi achiev thi glad tide and march toward palestin under the banner of khilafah
283	islam ha declar jihad an oblig the muslim of kashmir palestin are wait for the roar of the arm forc of pakistan their tank fighter jet they should use these resourc to fulfil the duti of liber the muslim from the infidel
284	883623701 white woman dont support blm you idiot they are just a dement a the men but if it werent for massiv faggot aka the other race fuck off cunt the other race dont support genocid that whi most nonwhit support black live matter
285	jihad is obligatori until we liber all thi land from kuffar and their slave secular regim
286	390472061 if you look at demograph and at the pattern of modern on fertil and look at it global our situat isnt actual bad longterm it bad shortterm secular liber is child murder period and everi group that adopt it is doomedalso period jew particular the jew who present the largest problem are a die breed 80 of their woman marri outsid of their race if they marri at all and they have veri few child so our descend will not have to deal with kike becaus their antiwhit shitlib genocid atheist shit hit them harder than it hit u nigger and spic are not immun to propaganda quit to the contrari they suffer from it more sever than white dowhit peopl make up the lowest percentag of homosexu and tranni in the nation and most white faggot and troon are jew the amish meanwhil liter can not be stop noth short of a deliber unambigu genocid will prevent them from becom the domin ethnic group in america by 2150 curti yarvin did some pretti hardcor statist analysi and estim that the u will remain major nonwhit until about the 2090 at which point white will becom the major again becaus the conserv christian cultur is the onli viabl one it is not a question of whether or not we win of cours we will were the superior race the question is how much our peopl will suffer in the immedi not whether our greatgrandchildren will triumph but whether our child will suffer or not these faggot and tranni and kike are constantli seeth constantli anxiou becaus they know thi that is whi they are tri so hard it desper theyr fight a lose battl against time and their onli relief is to tri and inflict the terror and pessim that they rightli feel against you draw strength from it but never allow yourself to succumb to it
287	13774632 whi black peopl you may ask becaus it is the onli race with domin gene that is dumb enough aborigin and some pajeet may be dumber but their gene are nowher near a domin so what is happen with black peopl today 12 year ago the current level of racism didnt exist in fact peopl thought racism wa over but a we look now it is onli becom worst and scalat whi becaus the white that gave you all the power are promot racism against black peopl now whi becaus the day you are no longer need are near so soon they will get rid of you white are virtual extinct white under the age of 40 year old are onli 300 million thi mean white societi are pretti much extinct alreadi if the peopl that control the world want it they could get the entir western world black in 20 year but they are not do it becaus they still need white to defeat their enemi china after that they will finish the genocid so what is the futur of black peopl after that the same a white africa will becom mix race like the rest of the world and they will use asian arab latino and pajeet for that in the end the entir world will becom veri similar in look with south indian and the onli white left will be the rull class you will live to see with your own eye the persecut and genocid of black peopl becaus we are alreadi in the endgam
288	after see thi pictur doe islam teach u peac absolut not onli jihad is necessari to fight with israel and inshallah there will be a day when we finish israel from the earth we are muslim if we will get martyr we will be call sahe
289	390446347 we write fantast literatur our intellect is unmatch to all other race on thi planet sneaki alway tri to bend the rule replac the word we and our with white and unmatch is open to interpret while concern i am excit to see what the collect white race will do in the face of such advers such a thi impend genocid wtf doe thi mean thi isnt a compliment you talk like an outsid observ
290	without jihad thi world can not be peaceful until all believ get defeat we have start a cyber jihad against you peopl becaus you peopl are attack islam honor of muhammad pbuh in cyber world islam will lead the world soon inshallah readi
291	32582076 911 wa a far moon land did not happen astral project is real 32582147 so basic your a wehraboo pol retard hitler himself wa the biggest caus of white genocid more than jew combin now if he wa pro white he wouldnt have sent million of german live and the live of other white peopl to the gutter for hi selfish gain the fsggot still lost lel
292	jihad is done for the sake of allah subhanahuwataala even if the infidel dont like it and a muslim should not be scare of admit that there is noth wrong in it it our absolut right dont chang the religion tri to make it appear peac they hate u anyway
293	883600020 agre we need to defund the militari and polic so normal hard work white men can final genocid feral nigger ape and faggot trooni pedophil
294	there will be jihad against the invad and stubborn infidel until the the day of judgement a for the israel israel will be elimin from the face of the earth by muslim soon or later inshallah
295	indian praiminst you well pay heavili for it inshallah al jihad ghazwa hind labaik ya muhammad
296	the time ha come to wage jihad against the disbeliev inshallah we are readi to give blood
297	inshallah we will take reveng we will kill everi singl from you jihad is the way to teach you that how to respect our prophet muhammad saw
298	inshallah veri soon the youth of tehreekelabeek pakistan with the help of jihad will wave the pakistani flag on the red fort and will keep thi arrog head separ from the bodi
299	if the govern realli want kashmir and jerusalem to be free then wage jihad at the offici level and give the leadership of prepar youth in jihad to hafiz saad rizviinshallah they will soon succeed in thi endeavor with the help of allah
300	390379054 spread subhuman nigger dna into the superior white dna gene pool is disgust and sadgiven the fact that superior ahit gene like intelligencecreativityphys fit and physic beauti are alway recess it actual onli speed up the white genocid you dumb fuck
301	390380644 becaus the problem is jew it alway been jew and for some reason everyon is too afraid to admit that out loud thi retard christianpost ww2 mental where jew are special oppress and must be protect ha result in them take over our countri becom the richest peopl on the planet and free to perpetr ani insan evil they can think of from pedophil blackmail ring to terrorist attack to falseflag war to sic govern agent against polit foe they openli and brazenli plot the genocid of everi white european person on the planet no matter their nation and no one say a thing even though it right out in the open among themselv they have absolut uniti and moral never factor in a long a they think what theyr do is good for jew theyll do it theyll steal nuclear bomb from america and give them to russia for exampl becaus they thought it wa good for jew right now hundr of thousand of white peopl are die in ukrain again becaus it good for jew thi is a problem that is never go to be resolv until we have open and honest discus about jewish supremaci
302	american need to fight so that the liber jewish system is upheld be grate for the jewish race becaus it is push all great antiwhit thing like femin immigr and white genocid you are white and you need to fuck be humili and kill so that jew can live in peac
303	883579352 they simpli want all white peopl dead and will say anyth they can if they think they can get you on board with ethnic suicid there is no interest in object truth just white genocid at ani cost if they can shame you out of white nation by say your dick is small theyll do it if they can shame you out of white nation by say polic execut nigger all day for fun theyll do it if they can trick you out of white nation by say zionist like desanti have your interest in mind theyll do it
304	soon inshallah the islam state will water it with the blood of the rawafidah
305	your blood come from mutah inshallah all your woman fall slave to the islam state
306	you son of mutah and incest know that the islam state is aliv and strong just like we have taken care you in the land of iraq sham and afghanistan we will not rest until you filthi grave worshipp are erad from the face of earth inshallah
307	inshallah we will turn kashmir into a islam statekashmir zindabaad pakistan zindabad afghanistan zindabad oic zindabad
308	whoever come in your way a an obstacl to establish islam rule in our kashmir can not be cure without be put to death land of allah rule of allah
309	the enemi of islam never rest but allah mujahid will never stop come for jihad in allah caus inshallah
310	im pakistani muslim inshallah one day ill come to palestin to do jihad against israel
311	jihad will continu until sharia implement in pakistan inshallah allah u akbar taliban
312	390454611 thi remain to be seen ive heard argument on both side he definit suck jewish dick thi much is certain but hi jewish oligarch launder hundr of billion out of russia through hsbc and into israel putin notic their lack of nation spirit jew did what jew alway do they parasit they didnt invest into russia and whi would they want to see white christian prosper the christcuck just cant seem to understand how much jew fuck hate them and want them all dead and putin is no except he like the rest of them all believ they worship the same god with the jew they dont jew worship satan in order to ascend to godhood thi is the mission of their messiah and messian process it gnostic lucif is the archetyp for knowledg and transform into higher be jew are transhumanist and whatev they believ about god the creator they dont see themselv in union with him until they ascend to godhood themselv thi is whi they are in partnership with lucif it complic to say the least suffic it to say they call the torah the belli of the snake becaus like a snake they see it a malleabl such that it secret can be extract through occult numerolog and divin they see it a word magic look up the kabylion thi is the mysteri of babylon and the core of all liber today putin like the rest of the christcuck cant even fathom the occultish depth of the talmud judaism so it is doubt that putin can break through the word magic spell over hi peopl invok by judaism sorceri and usuri the white spirit is too naiv to understand the spiritu mechan of of the kabbalah wizard putin would have to repent of hi wick degeneraci and call of christ for revel to fulli red pill and liber hi peopl from the princip of judaism
313	jihad will come back again inshallah and you will run away in the street like cattl and wait sure we too are wait
314	inshallah islam will rise from the land of islam emir of afghanistan i am veri despar to see islam rise again i want to see muslim stronger and prosper jihad taliban islam allamakhadimhussainrizvi eagleofislam afghanistan
315	ye inde our palestinian brother are do jihad to save their land from zionist settler inshallah they will free their land soon and ye those die in the jihad will be enjoy their time with hoor ul ain while oppressor will be burn in hell
316	for me it when the hollywood jew put out the man in the high castl the first year or two they put the typic pozz element usual julia ride the cock carousel to find herself and be empow make the white men either evil or cuck onion boy after that though they inadvert drop julia shit storylin distract becaus they couldnt go anywher and instead made john smith and inspector kito the de facto protagonist it becam about them tri to be good father to their son who were bound to duti they even made john smith a sympathet charact when he shown to have join nsdap when it the onli viabl mean to provid for hi famili and then backtrack to season 1 and 2 societi is shown to be peak comfi and evil uncl addi be shown a the ration charact who isnt tri to start a war with gloriou nippon hollywood jew oop big time and then rush to backtrack everyth with season 4 to kill the seri and have nig nog commi come out of nowher to win everyth
317	those who oppress kashmir will be destroy like bipinrawat but rais voic for kashmir is no le than a great jihad there is veri littl time in kashmir prosper inshallah it will soon be free from indian captiv
318	next fighter are readi and start their jihad veri soon there will a free state with the sacrific inshallah it time
319	know what kike are do hate nigger understand that hitler wa right now what ive taken the red pill and now it like live in a nightmar world
320	jihad against the foreign pimp pakistan is essenti to save human from the fanat in pakistan pakistan law are kufar and it religi secular ideolog is aa sick twist narr that one day inshallah will be destroy for good
321	390454611 thi remain to be seen ive heard argument on both side he definit suck jewish dick thi much is certain but hi jewish oligarch launder hundr of billion out of russia through hsbc and into israel putin notic their lack of nation spirit jew did what jew alway do they parasit they didnt invest into russia and whi would they want to see white christian prosper the christcuck just cant seem to understand how much jew fuck hate them and want them all dead and putin is no except he like the rest of them all believ they worship the same god with the jew they dont jew worship satan in order to ascend to godhood thi is the mission of their messiah and messian process it gnostic lucif is the archetyp for knowledg and transform into higher be jew are transhumanist and whatev they believ about god the creator they dont see themselv in union with him until they ascend to godhood themselv thi is whi they are in partnership with lucif it complic to say the least suffic it to say they call the torah the belli of the snake becaus like a snake they see it a malleabl such that it secret can be extract through occult numerolog and divin they see it a word magic look up the kabylion thi is the mysteri of babylon and the core of all liber today putin like the rest of the christcuck cant even fathom the occultish depth of the talmud judaism so it is doubt that putin can break through the word magic spell over hi peopl invok by judaism sorceri and usuri the white spirit is too naiv to understand the spiritu mechan of of the kabbalah wizard putin would have to repent of hi wick degeneraci and call of christ for revel to fulli red pill and liber hi peopl from the princip of judaism
322	well indian nightmar ha start insurg of taliban in kashmir will facilit by pakistan soon jihad will spread inshallah river will full with blood of hindu soon
323	even normal attenu viru vaccin are danger for kid due the interfer with their develop of type1 longterm immun henc big pharma get indemn for all it elixir on the childhood vax schedul the veri reason theyr push kid into the gene juic pogrom now to get indemn for all the flavor vaid theyv pump into biped lab rat on account of them all be deriv drug howev to experi on them with shit that exhibit immedi short now probabl medium term and like longterm and gener side effect is verit moloch sacrific the way i see is that greed ha blind so mani and they feel so secur behind indemn govt mandat administr liabil the plebe continu ignor and patholog denial mass format a well a the fog of confus that face the realiti of the pogrom elicit in the mass that theyr plough ahead regardless of consequ after all these are the most crimin organis on earth and to finger them would like the tobacco trial x100 everyon is affect thi time around and few want to take such the suppository red pill that is need to rootandbranch tear the system down
324	if you strive to be the shahe you must be will to sacrific yourself and defeat the kufr inshallah islam muslim jihad
325	the western kuffar split the muslim into differ nation state and weaken the muslim and now they are commit blasphemi against our belov prophet saw establish khilafah unit the muslim and jihad against the kuffar is the onli solut khilafahsilencesblasphemi
326	390357928 brenton tarrant awaken the sleep european soul it over for islam
327	390106277 hail saint brenton i am aspir to be one of your discipl i hate muslim witha passion truli breivik your bless realli gave u a holi highscor and a butterfli effect tarrant indirectli made sri lanka bankrupt inspir mani american and norweigan chad shoot and still inspir payton after the pandem if i had a gun and a book and some muslim god i promis to write ur name on it chad 0
328	o offic of pakistan arm forc how will you answer allah swt when he swt hold you to account for not bring yourselv your tank your artilleri and your missil into immedi action erad the crimin jewish occup in answer to the cri of the child of palestin in the past two pain day fortyfour muslim includ child have been martyr whilst more than three hundr have been injur a a result of the savag bombard by the jewish forc of the gaza strip palestin where even the hospit wa not spare from indonesia to morocco the islam ummah is react restlessli in anger compel by the power bond of brotherhood in islam howev the ruler over the neck of the ummah includ the ruler of pakistan are motionless but for lip servic the ruler of muslim react a if thi bomb is not upon the home of the muslim of palestin the bless land the land of the first qibla the israa and miraj of the messeng of allah saw they do not even react a they would have if thi open destruct were just some militari exercis destroy tree bird insect and shrubberi in land far far away wors these ruler are even appeal to the veri scoundrel and terrorist the western state and their socal intern commun upon which the jew depend whilst commit these crime uninterrupt o arm forc of pakistan you see that whenev the jewish exist want it bath the muslim of palestin in their own blood should not the jewish entiti fear that due to it crime if even a singl armi of muslim move it will result in the end of exist despit it support from western state should it not fear and desist becaus it is surround by muslim land and their arm forc no the jewish entiti ha no fear of militari respons becaus it know that the ruler of muslim are agent of coloni who will never move against it instead they line up in row to normal it exist so how long will you allow those who care noth for the sanctiti of alaqsa muslim land and the blood of muslim to restrain you o offic of the arm forc of pakistan o son of salahudin uproot the throne of these shameless ruler and treacher leadership give nussrah for the khilafah caliph on the method of prophethood that will annihil the jewish occup almasjid alaqsa await the roar of your liber tank ship artilleri and gun it await the takbeer of your infantri and ssg befor you offer salah after victori within it bless precinct so grant your nussrah for the khilafah so that you rais takbeer a you are led in jihad by the khaleefah of the muslim allah swt said
