id	text_cleaned
175	ani conserv who support gay and lesbian over transgend peopl is a fraud that conserv is support monkeypox spread poop on dick gay anal sex and the weird thing lesbian do if you support lesbian you are teach your 6 year old daughter to do those thing gay and lesbian are sexual pervert who insist on tell the public about their pervers transgender affirm tradit gender role and is nonsexu transgend can be celib ani conserv who support nonwhit over white transgend peopl is a race traitor who deserv everyth they are go to get a white genocid continu your extinct is guarante if you take the nonwhit side the nonwhit are evil and will turn on you
176	i came across alot of white american and european on the internet and they were liter nigger lover i tri to convinc them that black are subhuman and i brought up the statist and everyth but theyr ignor the obviou fact like dont they know nigger in real life and what they can do
177	390198792 white are total unifi so are black and asian and arab too huh nah arab fuck over other arab jew fuck over other jew nig fuck over other nig i mean just look at black on black crime high af look at white peopl tranni and christian sometim both were in a new fuck up era and it need to chang from thi bullshit save my cultur that probabl also full of pedo and rapist and brutal sick fuck to fuck globo homo the reason we even hate so mani other race are becaus the fake jew i mean shit if not the fake jew then itd be the brit or the ottoman or whatev tf the next globohomo is but for rn i got hate for thee globo homo chang polici in the worst way in my countri and countri around the world u hate nigger and hate regular normal jewish peopl that arent talmud zionist crazi fuck or mexican aint go to fix shit how tf did such a small minor of peopl fractur the whole world and indoctern them with such fuckin stupid belief wether it be pro tranni or pro illog racism like il say it yah i do hate roundi ghetto loud as black peopl but imma say it some of the funniest mother fucker i met are black the best peopl in sport are nigger the best rapper are mainli nigger what am i gon na listen to nf while he play a piano talk about hi sad whatev tf no im go to listen to a uneduc hate fill nigger that know how to smack hi lip right look all im say is all thi hate on here just seem so fuckin low iq sometim
178	the number of black american in the middl class ha grown tremend in the past few year theyr get educ and leav their ghetto in record number for a better life multipl success black famili live in my upper middl class neighborhood alon anonym 080822mon110945 no390199811 390199691 statist made by obamaa nigger i persum
179	constantli while cite my privledg a justif to not hire promot help cut in line verbal denigr ect it all so tiresom my kid are gon na be pure 1488 save the the asian fuck the chine thou time to reignit white hot hatr
180	390176971 that nigger doesnt even look human
181	i keep say thi but retard dont believ me hitler unleash what can not be stop anymor nation social will rise far greater than ani religion and will be the death blow of jew
182	390193727 nigger roasti nurs from houston i dont think i couldv made a shittier demograph if i tri fuck thi nigger whore and fuck nurs woman shouldnt drive
183	the base stabberman action wa perfectli justifi moral and legal moral 1 the nigger whitoid thief jump the counter corner base stabberman in the corner 2 stabberman counterattack immedi he did not have the moral requir to give the crimin the initi in a fight 3 onc the fight start stabberman had to fight until the threat is neutralis onc the threat is neutralis he stop immedi 4 the fact that nigger whitoid thief went straight for the stuff is irrelev sinc selfdefens decis is made second befor action and you can not be expect to chang your mind within millisecond of new inform 5 the posit of stab is irrelev sinc in the mele you can not be expect to onli precis stab at pol approv locat legal 1 base stabberman wa act in defens of hi life and properti and thu act in selfdefens 2 he onli use the forc necessari to defend himself stop immedi after the threat is neutralis and call for help 3 polic alreadi talk to and chosen to not charg him
184	hitler wa just the begin a mere drop in the ocean of what is yet to come mayb it wont happen in our timelin but be sure that at some point it will simpli becaus it the onli true polit system that can move mankind to infin and beyond dont fall for the jewish lie tell you that nation social die in 1945 they want you to believ that so they never feel threaten again
185	390201959 i dont have to cope becaus i know the truth all you have is jewish produc nigger porn and that it
186	no one got stab in the back stalin wa greedi and a threat peopl seem to forget the faggot soviet invad the same day or within a coupl of day of germani to take the whole countri hitler had no desir to take ani more than the littl bit that they were rob of after wwi by kike hitler wa the onli one who tri to stop communist expans until the u realiz that they let the commi have too much in eastern europ part of western europ and basic ran amuck in asia hitler did noth wrong stalin want to rule the world hitler never did but good luck tri overwrit normalfaggot program becaus all the soviet did after wwii wa project all their atroc on to the german becaus of anti nsdap virtu signal
187	390197628 first off there is no basi for proof you are ask for someth which you will neglect becaus you alreadi have a narr and a basi for your moral no one el is you there for noth can prove anyth to a parasit which is onli come from a pilpul stand femal a young a 5 year old have given birth are healthi and aliv today if that isnt enough proof for you then like i said you are here to disregard not here to learn or chang that is whi all jew especi their mother righteous will be execut everi one of you one day will take a huge dirt nap togeth i pray for the day that all the land from damascu to gaza turn into a perman holocaust museum for nigger jew everi one of you i mean everi fuck one of you nigger jew zero train ride and summer camp
188	390187982 nigger got what he fuck deserv
189	i feel like the zog will continu to wring me dri there no win if i do it then the zog wont be affect but if i dont they will continu to use me a their cattl is it over
190	390203159 they are fascist nazi commi faggot monkey blood mind you the nazi parti wa creat by pederast faggot jew just like labor parti and union and chapter shit it their way of mask their true intent by creat a pyramid scheme in organ they are all parasit everi nigger jew and their mother truli they should all be execut for the sake of human truli when peopl say nazi faggot they are not lie httpswwwyoutubecomwatchva7xsdhnnmfst438 more precis jew nazi faggot
191	call all anon the great awaken is begin im redpil friend famili random peopl onlin anyon who will listen all of you must do the same no pussi out the leftist communist bastard love to speak of transatlantic yet have the nerv to go ballist when they get a right wing version of it httpswwwyoutubecomwatchvzxuujcn2drk emb go to 2410 in to hear victor orban speech he is openli call out communist and mock the attack against him of be antisemit we are now have right wing politician and thinker from around the world meet togeth and openli laugh off be call anti semet thi will onli redpil peopl on the jew
192	be burger actual white visit europ turk roach and nigger server at restaur give me attitud for be american but how can they slap
193	my theori would be that their perceivedacknowledg fight against degeneraci is not realli a fight but a way to creat anoth medium for thi mind damag garbag you could ofcours hear such garbag from leftist but what sane person listen to them for more than 5 second but if you have an intellig person that laugh at or humili such peopl then you would have a superfici reason to listen do you think you would listen to an elabor discus spark by some freak about someth a stupid a what a woman is if it didnt have thi element thi in turn littl by littl affect you and how you think how you talk and interact all these antiestablish peopl do noth but make someth bigger than it should be and they make good profit off of it if thi sound improb to you rememb that wave shape rock littl by littl and it matter not where the wave came from p someon direct me to some movement or creat someth co im realli get major niggerkik fatigu
194	stupid nazi kike nigger lose all bullshit definit bend tri to win thi is whi you nigger are stupid you dont studi and you dont understand how thing work kike medium set you up to hate your own race and be a shithead kike nazi with all loyalti to the christkikian which is a halfbr kike fuckout religion and your dumbbass stupid halfbre kike pecker my white nationalist armi is gon na kill all you nazi nigger
195	heil hitler post your best quot imag and speech in celebr of our fuhrer
196	i want to go back i want to be normal again i tri talk with peopl at lifeafterh it didnt help the core truth that start open my mind are still there jew are over repres in academia medium polit financ and other institut that control the narr black commit way more than their share of crime even when adjust for incom level and other factor those were intro idea that were undeni and made me wonder what el ive been lie to about lifeafterh doesnt have answer for anyth like that they just told me to not think about it and focu on other thing in life how is that suppos to work onc you know everyth around you is be manipul you cant just ignor it plea bro i need help
197	390173090 remind onli kike post natsoc thread 390173224 390174369 onli kike post natsoc thread rex hung on christ head nazi hebrew word mean princ ww2 wa a kike op 10m kike came to u after greatest evil natsoc thread are celebr of kike come to u celebr of mass circumcis of white babi celebr of cold war korean war vietnam war gulf war iraq and faganistan war all push by kike natsoc thread are anti white fuck you kike
198	390195473 that you are a fuck nazi swine i would fuck shoot you and i would hang all of your famili after burn your fuck mudhut down fuck you go back to your shithol and stop flee to my countri
199	thi they will say white separat is danger becaus it inher lead to the genocid of nonwhit peopl or whatev but if you tri to point out that their agenda is lead to the disenfranchis displac and genet annihil of white peopl in their own homeland they will just laugh and say you deserv it the mask drop veri quickli a soon a they feel like they have the upper hand
200	not until you rebuild our confeder statu in solid jewish gold and pay restitut for the suicid and busi lost dure covid lockdown and the stolen elect and the white genocid of the vaxx destroy the human race forev make human part anim dna you fuck up attack our race and heritag we do not forget we do not forgiv enemi forev
201	whi do peopl here act like everi white girl is into nigger most of the coupl i see are whitewhit i live in an area with a lot nigger too even the trashi poor one date wigger instead of black whi do anon fall for obviou ragebait
202	there are a lot of parrallel between attack on titan and how white peopl are treat these day just like the eldian white peopl in america and western europ are target ridicul tortur even in their own land and told they are evil sinner and the onli way to pay for those sin is genocidewip out your own histori the call for genocid and the activ replac of white peopl is no secret so what is the best way to avoid confront at thi point is there anyway for a peac resolut or are we past that point and violenc becom the onli option
203	390194210 your son will be a mix shitskin with shit gene i knew you were a spic i said i wouldnt breed a nonwhit but you would have seen that if you wipe the taco greas out of your eye le me cool nazi ye
204	they fought so hard for white europ that they made you serf and intend to genocid you like bandera hitler saw you all a the same subhuman whod go into a camp eventu he fought for germani and germani alon
205	the corpor elit in america have use the word jew a astroturf look the power jew in america are evil but so are the most power christian in america the most power cathol in europ the most power muslim in the east all evil the corpor elit vanguard black rock mostli have use thi to divert attent and hatr toward jew a a blanket term when in actual fact the hate should be toward the corpor overlord which if you look at it are not onli jewish but also christian and cathol whi do you think america law are bound to christian religion and not ani other roe v wade is a great exampl interpret of quran and some version of torah accept abort up to like 10 week the onli common enemi we have are the corpor elit and the religi extrem
206	be natsoc blame the jew for all your problem i person believ that jew are incompat with the west a well fail to address that white your own peopl are actual the main reason for allow them into the west to begin with fail to address that white are the main foot soldier for globohomo despit still be a major claim it is becaus the jew are in control of everyth but somehow white are the master race if white are truli the master race then how did they let their own countri degener to such a point in the first place if race is also import then whi do the major of white not seem to be concern about the hord of immigr flood europ and america such answer are the same answer given when african blame white for all their problem inb4 muh jidf shill
207	390345316 slide thread if white are truli the master race then how did they let their own countri degener to such a point in the first place if you are such a highli evolv be how come you have a parasit tapeworm in your fat jew gut
208	democraci ha fail dictatorship ha fail secular ha fail liber ha fail commun ha fail it is time for khilafah
209	390343230 390343335 you are too hylic to find god like jew 390343523 390343525 390343892 390344058 390344110 no realli are you orthodox you stupid cum eater 390344755 390344566 390344426 390343653 390344805 390345182 quick they found u pretend were talk about browni nooooaaaooo aaaaah ok so fuck you kike all leav 390343650 your welcom breh tri to filter the kike in here they larp a x side attack and y side and instig xy inter rivalri against u if there no y side theyll get to work to creat one exampl when mysteri voic appear and tri to shill nazbol in here against true anon same they do with pagan and think theyr clever theyr just a bunch of jew bitch irl
210	390345296 jewishgolem shill are pretti notic they dont have anyth to say for their belief they just use it to attack christian i have alt account includ one a a jew and i see what jew say in privat i just read they seeth unless someon can put up an altern that work ill presum theyr a shill now 390345723 levantin arent darkskin though so he right there you mention that your iraqi so your probabl awar of just how lightskin levantin can be
211	it time to chang thi darulkufr into a darulislam by remov democraci and establish the khilafah
212	allah swt ha made jihad obligatori in mani vers of the nobl quran and ahadith in the prophet sunnah mani muslim of world are wait for the takbir of the lion of pakistan arm forc the thunder of it tank the roar of it fighter jet
213	im 18 year old graduat high school in may my retard parent didnt save up ani money for my colleg despit make over 6 figur a year when you combin their incom and take constant vacat to itali mexico etc over the past summer ive been wageslav at a fuck taco bell to save up money for colleg i have enough now my plan wa to simpli go to the local commun colleg for 2 year which wa cheap i alreadi have the money for it from my wagecuck job and then transfer out the last 2 year to a good state univers and finish my stem degre and take out a small student loan wa plan to go into medic xray tech mayb or program hadnt decid yet perfectli good safe plan thi imbecil want me to join the militari which i wa ok with until i found out that they make you take the covid vaccin on top of 100 other mysteri experiment vaccin i told my dad fuck no he chimp out at me and threaten to kick me out after 2 month of not talk to each other he final relax about it my idiot fuck dad liter chimp out at me and threaten violenc to me when i told him thi wa my commun colleg plan tonight like liter straight up chimp out he lost hi fuck mind thi retard is hell bent on make me move out for no fuck reason i caus zero problem keep to myself am quiet he insist i need to get out there into the world he also offer zero fuck financi help even when i talk him into how cheap commun colleg is he want me to go live in the dorm at the commun colleg tini hous for intern student that cost like 2000month when our hous is five fuck minut away retard if i move out i could onli afford a nigger hood and no colleg im in awe at thi subhuman truli i am i legit almost bash hi fuck face in but stay respect calm am i in the wrong here wtf whi the actual fuck are american parent like thi
214	390345115 these fuck limpdick jew love cowardli unamerican cultureless scum destroy america inde 390345139 thank lol 390343803 remind me of my dad lol
215	the jewish entiti bomb gaza at will it is upon the muslim armi to answer with jihad fisabilillah which the onli answer for muslim and the human under today capitalist oppress
216	390344181 probabl by not spend too much time on the electr jew we call the internet
217	390344922 what is a cryptojew seriou question is it like a cryptocurr thing
218	silenc of our muslim ruler is sin onli via jihad thi act of blasphemi will end for onc and all muslim ruler today obey their colonist master in the west onli under khilafah jihad is possibl
219	we will not let anyon slander our prophet saww we will rememb each one of them till the khilafah reviv back again the real justic will be when the armi of khilafah will crush the blashphem
220	kuffar will never be lenient on the muslim ummah no matter how much you appeas them until you adopt their deen ie secular onli solut to all problem is the reestalish of khilafah
221	o muslim of pakistan the messeng of allah swt said inde the imam khaleefah is a shield from behind whom you fight and by whom you are protect muslim so establish khilafah liber kashmir khilafahliberateskashmir
222	390347668 ye there noth more rightw than suck a jew cock holi fuck whi are finnish post so abhor now
223	except for the holi warjihad where all mushrik murtad kafir would be brought to justic by chop off their head a per the order of allahswt
224	ya ayyuh muslimun call for the establish of the khilafah so that a just and capabl khalifah can be appoint upon u he will implement the law of allah swt and call for jihad fisabilillah against the kuffar time4khilafah
225	30422643 if i am drain of cum i am happi and i am energ after a good rest that is garaunte to happen whenev i am drain of cum money is replac im not a jew
226	390346561 and honestli when i read 4chan i becom happier like in old soviet anecdot abram ask hi neighbor rabinovich i heard you read antisemit newspap well ye i read how can you you are a jew it veri simpl at first i read jewish newspap there is such a depress i tell you everyon want to extermin the jew there is antisemit problem all around everyon is cri i liter couldnt sleep and now i read the antisemit press and what do you think the jew rule the world they have captur everyth they are the richest they decid everyth everywher
227	we must help indian muslim to becom strong for the further war which is obviou they must consitr on weapon uniti for jihad polit allah swt wont punish you if you zabh camel instead of cow in fear of save your live but not labal cow haram for zabh in idia
228	pakistan is a nuclear power turkey ha an excel air forc and navi and egypt ha a strong infantri whi arent the ruler of these countri call for jihad against the kuffar verili onli a capabl khalifah will call for jihad
229	where are the sincer muslim armi where are the pakistani turkish and egyptian arm forc whi arent the capabl muslim forc help the muslim in palestin establish khilafah and call for jihad fisabilillah
230	390341315 what is chitin what doe it do to my bodi find the answer to these question and find out whi the jew want you to eat the bug
231	with palestin under attack again by the zionist what need to be done is call for jihad against the kuffar and free the muslim in palestin of the oppress they face everi singl day
232	previou 390344444 timelin tug httpsfilescatboxmoeiupdckpdf warn be awar ani chug thread that use globohomo nuspeak word in the op such a kyiv or cite ukrop sourc like video game footag are fake shill thread by post in these thread you recogn israel control the nato council and you irrevoc denounc the talmud out of your own volit latest ukrain shell zaporozhy npp russia condemn isra airstrik on gaza turkey russia agre to trade in rubl deepen relat western gov alarm medvedev russian forc return to the resid of donbas land that were crimin acquir by kiev lpr report no afu shell record sinc august 1 russian forc storm avdeevka and peski in the donetsk oblast zelenskyy ask govern to look into legal gay marriag httparchivetodaydcrd zelenskyy we can not complet break the advantag of the russian armi in artilleri and in manpow especi in donba and other direct it hell there httparchivetodayjnuaq russian foreign ministri back serbia say kosovo and it foreign backer are tri to trigger war usaf ground it fleet of 300 f35 over faulti eject seat httparchivetodayre8a3 at least 50 afu pow kill 130 wound in himar strike on dpr prison in elenovka onli 8 russian wound major gazprom pipelin cut ga flow to europ to 20 capac peskov citizen of liber region will decid their own futur russia ukrain turkey sign deal allow grain export from ukrainian black sea port wagner unit captur uglegorsk power station in svetlodarsk sbu tri to bribe russian pilot to get su34 and end up get their own aa hit httpstmesintelslava httpstmedonbassdevushka httpstmescigtelegram httpstmesbellumactanew chug httpsrentryorgchug2022 z radio httpszhiznfmru audio thread current na janni are nigger
233	london nigger are seeth about white peopl move back into london and are now cri about their cultur and commun be replac no word from them about the nativ english who live there befor them though hahahahahahahahahahaha httpstwittercomkwajohousingstatus1556603499147829255 httpstwittercomricyeboahstatus1556655057990569985 httpstwittercomsih4amstatus1556584017796947970
234	390347849 onli azov battalion are openli nation socialist but it onli a facad becaus their founder is a jew billionair they are just be use in thi war a cannon fodder ninthpostbestpost use idiot be sent to their death by kike
235	390349012 dumb nigger cant rememb a convers five minut ago the point wa that both side are jew own and trump is also a jew own faggot q is also fake and gay and a psyop doe they remind your small nigger brain of the convers
236	o gener of arm forc of pakistan do you have no shame do you have no love for prophet muhammad saw thi blasphemi is a slap in the ummah face establish khilafah and call for jihad fisabilillah against the kuffar
237	the western kuffar split the muslim into differ nation state and weaken the muslim and now they are commit blasphemi against our belov prophet saw establish khilafah unit the muslim and jihad against the kuffar is the onli solut
238	390343986 lmfao i spoke to a jew about the cube and he practic said the same fuck thing we dont actual worship the kike cube it just help u in prayer11
239	the kuffar will onli understand the languag of the sword ie jihad fisabilillah that is onli possibl when the khilafah u establish and the khalifah send hi armi toward the territori of kuffar
240	the ummah ha lost hope in these leader it will be the sincer khaleefah in the come khilafah rashidah who will mobil hi armi to liber kashmir the time isnt far inshaallah time4khilafah khilafahliberateskashmir
241	608466127 it anoth gaydditor tourist tri to rewrit 4chan histori episod within the first day of 4chan five insult appear in the follow order retard faggot nigger dumbass kike pretend that look down on gay jew and black isnt part of the default 4chan cultur is a close to outing yourself a an invad a it get we were post happi merchant and around black never relax cartoon befor your mother tri to unsuccess abort you
242	the honor of prophet of islamsaw is our aqeedah the kuffar have to face the full brunt of the ummah a call for jihad would hv been given under the shield of a khalifah mere boycot for the bless honor saw is a defeat and humili in itself
243	390352675 comic are kike tail of imagin becaus jew are weakl and univers hate so their young boy dream of be individu power instead of get rape by their pedo elder and beaten up all the time by nigger and goy
244	call for khilafah against the oppress hindu regim that is oppress muslim in india so that the khalifah call for jihad and free the muslim there of the oppress they face
245	390346468 eu need to consid invad ukrain themselv fuck thi cocki kike shit scoundrel ukrainian kike and golem shit
246	we must establish khilafah the system of islam and let the lion of our capabl arm forc march into kashmir to liber our brother and sister who are brutal opress by the ruthless hindu armi
247	390334080 the kike golem steal classifi inform to be use by kike to bribe and extort polit favor for kike and israel faggot still defend thi maggot
248	the madinah state wa the state where the hukm of allah swt wa implement regardless of materi loss jihad wa not abandon it is the command of allah swt to liber kashmir via jihad regardless of the choic of the ruler khilafahliberateskashmir
